{
  "$schema": "../../schemas/adapter-manifest.schema.json",
  "manifestVersion": 1,
  "id": "mock-wheel",
  "displayName": "Mock Differential-Drive Robot",
  "version": "1.0.0",
  "platform": "linux",
  "protocol": "roc.adapter.jsonl.v1",
  "capabilities": [
    "incident.status",
    "job.cancel",
    "motion.linear",
    "navigation.obstacle-avoidance",
    "patrol",
    "status.robot",
    "telemetry.basic"
  ],
  "jobTypes": ["DELIVERY", "INSPECTION", "PATROL", "STOP"],
  "requires": [],
  "entrypoint": ["python3", "adapter.py"]
}
